Unnamed: 0;fecha;HORA declarada;Ruta;Operador;flight_no;route;ac_type;registration;cn_ln;all_aboard;PASAJEROS A BORDO;crew_aboard;cantidad de fallecidos;passenger_fatalities;crew_fatalities;ground;summary;Lugar_Despegue
2874;1976-09-26;0830;Near Alpena, Michigan;Military - U.S. Air Force;flight no Definida;Kenneth Ingalls Sawyer - Oscoda-Wurtsmith;Boeing KC-135A;61-0296;18203/518;20;15;5;15;12;3;0;Crash-landed in rugged terrain broke up and landed in a swamp. Possilbe cabin pressure problem causing the plane to disintegrate in the air.;Kenneth Ingalls Sawyer 
2875;1976-10-04;?;Nairobi, Kenya;Emirates Air Transport;flight no Definida;Sharjah - Djibouti City - Nairobi;Douglas DC-7CF;TZ-ARC;45467/970;4;0;4;4;0;4;0;The cargo plane struck Mt. Kenya while descending to land. Descended prematurely.;Sharjah 
2876;1976-10-06;1324;Off Bridgetown, Barbados;Cubana de Aviacion;455;Bridgetown - Kingston;McDonnell Douglas DC-8-43;CU-T1201;45611/48;73;48;25;73;48;25;0;Ten minutes after taking off from Barbados the aircraft reported an explosion aboard. The plane was seen below the overcast trailing smoke. The aircraft crashed into the Caribbean sea. Detonation of an explosive device in the aft of the cabin which initiated an uncontrollable fire which led to the incapacitation of the crew.;Bridgetown 
2878;1976-10-13;0137;Near Bombay, India;Indian Airlines;flight no Definida;Mumbai - Chennai;Sud-Aviation Caravelle VI-N;VT-DWN;231;95;89;6;95;89;6;0;The aircraft crash landed in flames during an emergency landing. The right engine failed during takeoff. A fatigue crack in compressor led to engine destruction, severing of fuel lines and fire. The fire spread because the crew did not shut off the fuel supply.;Mumbai 
2879;1976-10-28;?;Near Petrolia, Brazil;Nordeste Linhas Aéreas;flight no Definida;Petrolina - Recife;Embraer 110C Bandeirante;PT-TBA;110004;7;5;2;2;0;2;0;The airplane was seen to initiate a turn to the left when it stalled and crashed in a field.;Petrolina 
2880;1976-11-04;?;Banjarmasin, Indonesia;Bali International Air Service;flight no Definida;Manado -Gorontalo - Palu - Balikpapan - Banjarmasin;Fokker F-27 Friendship 100;PK-KFR;10142;38;33;5;29;25;4;0;After overshooting the runway, a go-around was initiated but abrupt application of power made an engine autofeather after which the plane crashed.;Manado 
2881;1976-11-05;?;Atlantic Ocean;Inair Panama;flight no Definida;Curacao - Port-au-Prince;Douglas DC-3;HP-671;43073;2;0;2;2;0;2;0;The cargo plane went missing between Curacao - Port-au-Prince.;Curacao 
2885;1976-12-17;1940;Ust-Kut, Russia;Aeroflot;flight no Definida;Ust-Kut - Kirensk;Yakovlev 40;CCCP-88208;9631349;7;4;3;7;4;3;0;The cargo plane crashed into trees on takeoff. Deviation in preparation for the flight by the crew and pilot error in the technique used during the takeoff.;Ust
2886;1976-12-17;21:30;Kiev, USSR;Aeroflot;H-36;Chernivtsi - Kiev;Antonov AN-24RV;CCCP-46672;47309604;55;50;5;48;44;4;0;In heavy fog  the crew continued their descend below decision height, although they had not obtained visual contact with the runway. The fact that visibility had decreased below minima (700 m) was not reported to the crew.;Chernivtsi 
2891;1977-01-13;0636;Anchorage, Alaska;Japan Air Lines;flight no Definida;Mosses Lake, WA - Tokyo, Japan;Douglas DC-8;JA8054;46148/553;5;0;5;5;0;5;0;The cargo plane crashed while attempting to take off. Alcoholic impairment of captain. Flightcrew members did not prevent captain from attempting to fly. Blood alcohol of 0.21.;Mosses Lake, WA 
2903;1977-03-29;?;Bainaha Valley, Indonesia;Merpati Nusantara Airlines;flight no Definida;Palu - Toli Toli;de Havilland Canada DHC-6 Twin Otter 300;PK-NUP;486;23;20;3;15;13;2;0;After spotting a mountain in front of him, the pilot applied full power and went into a steep climb. The plane stalled and crashed into trees.;Palu 
2905;1977-04-04;1619;New Hope, Georgia;Southern Airways;242;Huntsville - Atlanta;McDonnell Douglas DC-9-31;N1335U;47393/608;85;81;4;62;60;2;8;The aircraft sustained a broken windshield and loss of power to both engines after penetrating a thunderstorm and encountering hail. The plane crash landed on a highway and exploded in flames. Total and unique loss of thrust from both engines while the aircraft was penetrating an area of severe thunderstorms with heavy precipitation and hail. The hail clogged bleeder valves in the engines causing multipe engine surges until the compressors tore apart. Contributing factor was the failure of the company's dispatcher to provide the flight crew with up-to-date severe weather information.;Huntsville 
2907;1977-04-19;?;Tapa AFB, Estonia;Military - Soviet Air Force;flight no Definida;Parnu - Tapa;Antonov An-24;Placa de Avion no Definida;cn_ln no Definida;21;15;6;21;15;6;0;Crashed into a building while attempting to land in snow and poor visibility.;Parnu 
2910;1977-05-13;0845;Beiruit, Lebanon;LOT Polish Airlines;flight no Definida;Varna, Bulgaria  - Beiruit, Lebanon;Antonov An-12BP;SP-LZA;6344307;9;0;9;9;0;9;0;The cargo plane struck power lines and trees while attempting to land.;Varna, Bulgaria  
2911;1977-05-14;0933;Near Lusaka, Zambia;IAS Cargo;flight no Definida;Nairobi, Kenya  - Luskaka, Zambia;Boeing 707-321C;G-BEBP;18579/332;6;1;5;6;1;5;0;The elevator assembly separated in mid-flight. The plane nose dived and crashed. The in-flight separation of the right hand horizontal stabilizer and elevator as a result of a combination of metal fatigue and inadequate failsafe design in the rear spar structure. Shortcomings in design assessment, certification and inspection procedures were contributory factors.;Nairobi, Kenya  
2912;1977-05-16;1735;New York, New York;New  York Helicopter;flight no Definida;Pan Am building - JFK Airport;Sikorsky S61L;N619PA;61427;25;22;3;4;4;0;1;While passengers were loading aboard the helicopter on top of the Pan Am building, the landing  gear collapsed causing the helicopter to tip on its side.  Four people, waiting to board the craft  were killed by the rotating blades. One of the blades tore loose and struck a window breaking in two. One-half of the blade then sailed two blocks striking and killing a pedestrian, 800 feet below the heliport. Fatigue failure of the upper right forward fitting of the right main landing gear tube assembly. The fatigue originated from a small surface pit of undetermined source.;Pan Am building 
2915;1977-06-20;?;Salto-Nueva Hesperides, Uruguay;Fuerza Aérea Uruguaya;flight no Definida;Carrasco - Salto-Nueva Hesperides;Embraer 110C Bandeirante;CX-BJE;110083;15;13;2;12;10;2;0;Crashed into trees while making an ILS approach.;Carrasco 
2916;1977-06-21;2230;Off Wake Island;Military - U.S. Navy;flight no Definida;Wake-Agana;Lockheed EC-130Q;156176;4280;16;0;16;16;0;16;0;Crashed into the Pacific Ocean and exploded moments after taking off from Wake Island Air Base. The plane rose no higher than 400 ft. before crashing one mile from the end of the runway.;Wake
2917;1977-07-06;23:30;Saint Louis, Missouri;Fleming International Airways;flight no Definida;Saint Louis, MO - Detroit, MI;Lockheed L-188AF Electra;N280F;1076;3;0;3;3;0;3;0;After taking off the cargo plane's No. 2 engine did not develop power, the plane rolled to the right and crashed. Attempted operation with known deficiencies in equipment. Failed to follow approved procedures. Inadequate maintenance and inspection.;Saint Louis, MO 
2920;1977-07-20;?;Vitim, Russia;Aeroflot;B-2;Vitim - Irkutsk;Ilyushin IL-14M;CCCP-52096;086806109;40;34;6;40;34;6;0;The crew attempted to take off in tailwind, stalled, contacted trees and crashed;Vitim 
2922;1977-07-24;1900;Near Puerto Montt, Chile;Military - Chilean Air Force;flight no Definida;Punta Arenas - Santiago;Douglas DC-6B;FAC-989;45534;82;75;7;38;31;7;0;Crashed into a swamp and burst into flames as it attempted to land in heavy rain at night.;Punta Arenas 
2923;1977-07-25;0800;Near Yoro, Honduras;Military - Honduran Air Force;flight no Definida;Yoro - Honduran;Douglas C-47;FAH-301;6096;40;36;4;25;0;0;0;The left engine exploded in flight and the plane crashed into mountainous terrain. Plane was overloaded with passengers.;Yoro 
2925;1977-08-20;2106;San Jose, Costa Rica;Monarch Aviation;flight no Definida;Catalina Island-Long Beach;Convair CV-880;N8817E;cn_ln no Definida;3;0;3;3;0;3;0;The cargo plane took off struck trees, crashed and burned.;Catalina Island
2926;1977-08-25;0540;Kona, Hawaii;Island Airways;flight no Definida;Honolulu-Kailua Kona;Shorts SC-7 Skyvan 3-200;N4917;SH-1850;2;0;2;2;0;2;0;The cargo plane stalled, went into a spin and crashed short of the runway. Failure to maintain flying speed.;Honolulu
2927;1977-09-02;0838;Off Hong Kong;Transmeridian Air Cargo;3751;Hong Kong-Bangkok;Canadair CL-44D4-2;G-ATZH;21;4;0;4;4;0;4;0;The No. 4 engine failed shortly after taking off. A fire developed and the plane crashed into the ocean. A loss of control following in-flight separation of the right-hand outboard wing section and the No.4 engine. These failures followed a No.4 engine failure, an internal engine fire and a fire in the aircraft fuel system eventually resulting in a massive external fire.;Hong Kong
2929;1977-09-06;1452;Mt. Iliamna, Alaska;Alaska Aeronautical Industries;302;Iliamna - Anchorage;de Havilland Canada DHC-6 Twin Otter 200;N563MA;196;13;11;2;13;11;2;0;Crashed in level flight  into Mt. Iliamna glacier at 7,000 feet. Failure of the flight crew to use proper navigational procedures for the route being flown especially their failure to use the available backup means of navigation to verify the position and progress of the flight. Recovery of bodies or wreckage not possible.;Iliamna 
2930;1977-09-08;?;Mt. Loi Hsam Hsao, Burma;Burma Airways;flight no Definida;Mongasat - Keng Tung;de Havilland Canada DHC-6 Twin Otter 300;XY-AEH;540;19;16;3;19;16;3;0;Crashed in the jungles of eastern Burma.;Mongasat 
2931;1977-09-12;0012;Yakutat, Alaska;Safe Air Cargo;flight no Definida;Yakutat - Anchorage;Douglas DC-7BF;N6314J;45359/868;4;0;4;4;0;4;0;The cargo plane did not gain altitude after taking off and crashed into trees 2.5 miles from the runway. The aircraft was overloaded and lost an engine on takeoff.;Yakutat 
2932;1977-09-14;2348;Near Albuquerque, New Mexico;Military - U.S. Air Force;flight no Definida;Kirtland AFB - Nellis AFB;Boeing - EC-135K;62-3536;cn_ln no Definida;20;0;20;20;0;20;0;Crashed into a mountain peak in the Manzano range shortly after taking off and making a right bank. The aircraft was observed flying too low and did not heed the controller's warnings. Fatigue may have played a part in the accident.;Kirtland AFB 
2934;1977-09-27;?;Kuala Lumpur,  Malaysia;Japan Air Lines;715;Tokyo-Hong Kong-Kuala Lumpur;McDonnell Douglas DC-8-62H;JA-8051;46152/550;79;69;10;34;26;8;0;The aircraft struck a hill 4 miles short of the runway while on  a VOR approach during a thunderstorm. Crew error. Descended below MDA.;Tokyo
2935;1977-10-20;1852;Near Gillsburg, Mississippi;L & J Company;flight no Definida;Greenville - Baton Rouge;Convair CV-300;N55VM;003;26;24;2;6;4;2;0;The crew diverted to Mc Comb because of low fuel. Both engines quit before the aircraft could land and a forced landing was attempted in a wooded area. The plane struck trees before it could make a forced landing in an open field. Lead singer Ronnie Van Zant, 29, guitarist Stevie Gaines, back up vocalist Cassie Gaines and assistant manager Dean Kilpatrick of the Lynyrd Skynyrd band killed.  Several other members of the band were seriously injured. Fuel exhaustion due to crew inattention of the fuel supply. Contributing factors were improper flight planning and a malfunction in the No.2 engine which caused a higher than normal fuel consumption.;Greenville 
2937;1977-11-03;?;San Cristobal de las Casas, Mexico;Servicios Aereos Martinez Leon;flight no Definida;Palenque - San Cristobal de las Casas;Britten-Norman BN-2A-8 Trislander;XA-FUA;0388;13;12;1;13;12;1;0;Exploded, crashed and burned on approach.;Palenque 
2940;1977-11-21;1004;Near Bariloche, Argentina;Austral Lineas Aeras (Argentina);flight no Definida;Buenos  Aires - San Carlos de Bariloche;BAC One-Eleven 420EL;LV-JGY;155;79;74;5;46;41;5;0;The flight crashed into high ground after a second landing attempt. Procedural error by the crew during the final approach in that they abandoned the ILS procedure. This was influenced by the interruption of the VOR signal.;Buenos  Aires 
2941;1977-11-26;0230;Near Beziers, France;Military - French Air Force;flight no Definida;Mont-de-Marsan-Hyères;Nord 2501 Noratlas;182;182;32;28;4;32;28;4;0;Crashed into mountains north of the city in fog and adverse weather conditions.;Mont
2943;1977-12-04;2036;Straits of Johore, near Kampung Ladang, Malaysia;Malaysia Airlines;653;Penang - Kuala Lumpur;Boeing B-737-2H6;9M-MBD;20585/306;100;93;7;100;93;7;0;During a hijacking and while descending from 21,000 to 7,000 feet, both pilots were shot and the aircraft crashed into a swamp.;Penang 
2945;1977-12-09;19:25;Tarko-Saley, USSR;Aeroflot;134;Tarko-Sale - Surgut;Antonov AN-24;CCCP-47695;27307602;23;18;5;17;13;4;0;The plane took off at night and entered a steep attitude after the flaps were raised and crashed.;Tarko
2946;1977-12-11;1120;Hierro, Canary Islands;Military - U.S. Navy;flight no Definida;Lajes-Lajes;Lockheed P-3B Orion;153428;185-5225;13;0;13;13;0;13;0;While on patrol the plane flew into a 4,200 ft. mountain at 1,200 ft.;Lajes
2947;1977-12-13;1922;Evansville, Indiana;National Jet Services Inc.,  (Air Indiana);216;Evansville - Nashville;Douglas DC-3;N51071;4837;29;26;3;29;26;3;0;The plane crashed during takeoff in rain and fog. Killed, were the entire Evansville basketball team. The aileron on one wing and rudder remained locked upon takeoff, which made it extremely difficult to bank. An attempted takeoff with the rudder and right aileron control locks installed, in combination with a rearward center of gravity. Improperly loaded luggage which resulted in rearward center of gravity which resulted in the aircraft's rotating to a nose-high attitude immediately after takeoff and entering the region of reversed command from which the pilot was unable to recover.;Evansville 
2949;1977-12-18;2014;Off Madeira, Portugal;SATA;730;Zurich-Genève-Funchal;Aerospatiale Caravelle 10R;HB-ICK;200;57;52;5;36;35;1;0;Ditched into the ocean while on a second approach. Crew error. Sensory illusion.;Zurich
2950;1977-12-19;0748;Vieques, Puerto Rico;Vieques Air Link;flight no Definida;St Croix, VI - Vieques, PR;Britten-Norman BN-2A Islander;N862JA;184;10;9;1;5;5;0;0;The plane made a forced landing in the ocean. Fuel exhaustion. Inadequate preflight planning. Mismanagement of fuel.;St Croix, VI 
2951;1977-12-24;?;Willemstad, Curacao, Netherlands Antilles;Valley Air Service;flight no Definida;Charlotte Amalie-Willemstad;Piper PA-31-350 Navajo;N9164Y;31-217;10;8;2;10;8;2;0;?;Charlotte Amalie
2956;1978-02-10;1120;Near Artigas, Uruguay;Uruguayan Air Force;flight no Definida;Artigas - Montevideo;Douglas C-47A-DL;T511;19301;44;40;4;44;40;4;0;The passenger flight attempted to make an emergency landing at Artigas Airport when it had taken off from.  An engine failure was followed by a wide banking turn and crash to the ground bursting into flames.;Artigas 
2957;1978-02-10;1650;Richland, Washington;Columbia Pacific Airlines;23;Richland, WA - Seattle, WA;Beechcraft 99;N199EA;U037;17;15;2;17;15;2;0;The aircraft crashed shortly after taking off from Richland after climbing to 400 feet and stalling. Crew error.  The failure and inability of the flightcrew to prevent rapid pitchup and stall by exerting sufficient push force on the control wheel. The pitchup was caused by the combination of a mistrimmed horizontal stabilizer and a center of gravity near the aircraft's aft limit. The mistrimmed condition resulted from discrepancies in the aircraft's trim system and the flightcrew's preoccupation with making a timely departure. The out-of-trim warning system was inoperative.;Richland, WA 
2959;1978-02-28;1030;Solvang, California;Security Air;flight no Definida;Visalia - Santa Barbara - Santa Maria;Aero Commander 500A;N6143X;500-0931-26;7;4;3;7;4;3;0;Continued VFR flight into adverse weather conditions.;Visalia 
2961;1978-03-02;1243;Kano, Nigeria;Nigeria Airways;flight no Definida;Abuja - Kano;Fokker F-28 Fellowship 1000 / MiG-21;5N-ANA / ?;11993;18;11;7;18;11;7;0;Midair collision. The Fokker collided with the MiG which was performing touch-and-go landings. Error by the MiG pilot. Sixteen killed on the Fokker and two on the MiG.;Abuja 
2964;1978-03-22;2042;Near Riverside, California;Lake Havasu Air;flight no Definida;Santa Ana, CA - Lake Havasu, AZ;Cessna T207A;N7354U;cn_ln no Definida;6;5;1;6;5;1;0;Crashed into a mountain in fog.  Continued VFR flight into adverse weather conditions.;Santa Ana, CA 
2965;1978-03-25;06:55;Okaraba, Burma;Burma Airways;flight no Definida;Yangon - Myitkyina;Fokker F-27 Friendship 200;XY-ADK;10235;48;44;4;48;44;4;0;After an explosion, the aircraft went spinning into the ground and crashed into a field.;Yangon 
2967;1978-04-05;1645;St. Thomas, Virgin Islands;Antilles Air;flight no Definida;St. John, VI - St. Croix, VI;Grumman G-21;N877A;1152;9;7;2;2;0;2;0;Made a forced landing in water. Fuel starvation. Inattentiveness to fuel supply. Fuel selector positioned between tanks.;St. John, VI 
2972;1978-06-23;?;Saint John's, Newfoundland;Gander Aviation;flight no Definida;Saint John's - Saint Anthony;Beech Queen Air A80;C-GGAL;LD-233;10;8;2;10;8;2;0;Crashed in heavy fog while attempting to take off.;Saint John's 
2975;1978-08-14;?;Sogamoso, Bolivia;Aeropeca;flight no Definida;Bucaramanga-Leticia-La Paz;Curtiss C-46;HK-1350;22557;18;15;3;18;15;3;0;The aircraft, flying VFR, collided with a mountain in deteriorating weather condtions after being blown off course which went unnoticed because of lacking navigational equipment.;Bucaramanga
2976;1978-08-26;?;Papun, Burma;Burma Airways;flight no Definida;Papun-Rangoon;de Havilland Canada DHC-6 Twin Otter 300;XY-AEI;541;14;11;3;14;11;3;0;Crashed shortly after taking off from runway 18.;Papun
2977;1978-08-30;0747;Las Vegas, Nevada;Las Vegas Airlines;flight no Definida;Las Vegas, NV - Santa Ana, CA;Piper PA-31-350 Chieftain;N44LV;cn_ln no Definida;10;9;1;10;9;1;0;Crashed on takeoff. Down elevator control stop backed out, limiting down elevator travel to 1 1/2 degrees of normal 20 degrees.;Las Vegas, NV 
2978;1978-09-03;?;Conakry, Guinea;Air Guinee;flight no Definida;Conakry - Bamako;Ilyushin IL-18;3X-GAX;187009803;17;9;8;15;8;7;0;Crashed in a swamp.;Conakry 
2979;1978-09-03;?;Coal Harbour, BC, Canada;AirWest Airlines;flight no Definida;Victoria harbor - Victoria Harbor Water Aerodome;de havilland Canada Twin Otter 200;C-FAIV;215;13;11;2;11;9;2;0;While on approach, the aircraft yawed to the left and plunged into the ocean in a left-wing and nose-down attitude and sank. In-flight failure of the left-hand inboard flap control rod that led to a sudden retraction of the complete left-hand flap system and sudden loss of control.;Victoria harbor 
2980;1978-09-03;1730;Near Kariba, Rhodesia (Zimbabwe);Air Rhodesia;825;Kariba - Salisbury;Vickers Viscount 782D;VP-WAS;297;56;52;4;38;34;4;0;The aircraft took off from  from Kariba Airport at 17.10.  Shortly after departing Kariba, the starboard wing was hit by a SAM-7 missile.  The crew tried to make an emergency landing in a large clearing in the bush. The aircraft crash landed, striking an irrigation ditch, cart-wheeled, broke up and caught fire.  Soldiers from the Joshua Nkomo's Zimbabwe Peoples Revolution Army, who were responsible for shooting down the airliner, later killed 10 of the 18 survivors. The remaining survivors were rescued the next day.;Kariba 
2981;1978-09-09;1447;Wrangell, Alaska;Temesco Helicopter - Air Taxi;flight no Definida;Wrangell, AK - Return;Soloy 12EJ3;N5384V;cn_ln no Definida;3;2;1;3;2;1;0;The helicopter experienced rotor failure. Undersized threads on anti-node bar.;Wrangell, AK 
2984;1978-09-14;1450;Paranaque, Philippines;Philippine Air Force;flight no Definida;Laoag - Paranaque;Fokker F-27 Friendship 200;PH-FKY;10328;28;24;4;21;17;4;12;The domestic flight crashed while attempting to land at Paranaque in thunderstorms with heavy rain and wind gusts. Possible lightning strike.;Laoag 
2986;1978-10-03;?;Near Kuopio, Finland;Military - Finish Air Force;flight no Definida;Kuopio - Helsinki;Douglas C-47A-1-DK;DO-10;12050;15;12;3;15;12;3;0;After taking off, one of engines stalled due to a damaged #5 cylinder exhaust. The pilot attempted to return to to Kuopio. He turned  but the plane lost control and crashed into Lake Juurusvesi.;Kuopio 
2988;1978-10-06;?;Santiago de Chile, Chile;Military - US Navy;flight no Definida;Military exercises;Douglas R6D-1 (DC-6);131618;43721/375;18;0;0;18;0;0;0;The military transport crashed into a fog-shrouded hill, 20 miles south of the city.;Military exercises
2990;1978-10-08;09:25;Kenai, Alaska;Era Helicopter - Air Taxi;flight no Definida;Kenai, AK - Return;Bell 205-1;N2215W;cn_ln no Definida;7;6;1;2;2;0;0;The tail rotor pitch control system failed shortly after taking off. The helicopter tried to return and crashed.;Kenai, AK 
2996;1978-11-19;1100;Near Leh, India;Military - Indian Air Force;flight no Definida;Chandigarh - Leh;Antonov An-12;Placa de Avion no Definida;cn_ln no Definida;77;70;7;77;70;7;1;Crashed into a mountain and burned short of the runway after experiencing engine failure.;Chandigarh 
2997;1978-11-21;?;Near Rubio, Venezuela;Aereo el Venado;flight no Definida;Cucuta - Arauca;Douglas C-47A;HK-1393;19053;27;24;3;27;24;3;0;Crashed in the Rubio mountains.;Cucuta 
2999;1978-12-04;1945;Near Steamboat Springs, Coloado;Rocky Mountain Airways;217;Steamboat Springs - Denver;de Havilland Canada DHC-6 Twin Otter 300;N25RM;387;22;20;2;2;1;1;0;Forced to return to Steamboat Springs due to severe icing, the plane crashed into a 10,530 ft. mountain.  Severe icing and strong downdraughts associated with a mountain wave which combined to exceed the aircraft's capability to maintain flight. Contributing to the accident was the Captain's decision to fly into probable icing conditions that exceeded the conditions authorized by company directives.;Steamboat Springs 
3008;1979-02-08;?;Near Agudos, Brazil;TAM Lineas Aéreas Regional;flight no Definida;Bauru - Sao Paulo;Embraer 110C Bandeirante;PP-SBB;100-010;18;16;2;18;16;2;0;Hit trees and burst into flames shortly after taking off.;Bauru 
3010;1979-02-12;1300;Clarksburg, West Virginia;Allegheny Airlines;561;Clarksburg - Washington DC;Nord 262;N29824;48;25;22;3;2;1;1;0;The plane crashed  inverted shortly after lifting off the ground. The captain's decision to take off with snow on the aircraft's wing and empennage surfaces which resulted in a loss of lateral control and a loss of lift as the aircraft ascended out of ground effect.;Clarksburg 
3018;1979-03-26;?;Luanda, Angola;Interflug;flight no Definida;Luanda-Berlin;Ilyushin IL-18D;DM-STL;186009402;10;6;4;10;6;4;0;The cargo plane lost the No. 2 engine on takeoff, overran the runway, crashed into the ILS localizer antenna, broke up and caught fire.;Luanda
3019;1979-03-29;?;Ste. Foy, PQ, Canada;Quebecair;255;Quebec - Montreal;Fairchild F-27;CF-QBL;0047;24;21;3;17;14;3;0;Engine failure shortly after takeoff caused damage so the landing gear could not be retracted and increasing drag during the critical climbout phase. Airspeed slowed until the aircraft crashed.;Quebec 
3020;1979-04-14;?;Off Avalon, California;Catalina Airlines;flight no Definida;San Pedro, CA - Catalina, CA;Grumman G-21 Goose;N11CS;1166;11;10;1;1;1;0;0;During an attempted go-around, the plane struck boat wakes and crashed. One passenger drowned.;San Pedro, CA 
3023;1979-05-25;2040;Bullen Point, Alaska;Sea Airmotive;flight no Definida;Bullen Point - Deadhorse;de Havilland Canada DHC-4A Caribou;N581PA;253;3;0;3;3;0;3;0;The cargo plane crashed in heavy crosswind while attempting to takeoff. Inadequate preflight preparation and/or planning. Pilot in command failed to follow approved procedures,directives,etc. Cargo shifted.;Bullen Point 
3024;1979-05-25;1504;Chicago O'Hare, Illinois;American Airlines;191;Chicago, IL- Los Angeles, CA;McDonnell Douglas DC-10-10;N110AA;46510/22;271;258;13;271;258;13;2;During takeoff just, as the plane lifted from the runway, the left engine and pylon separated from the aircraft damaging the wing and hydraulic system which caused the aircraft to roll and crash. Highest single plane death toll in U.S. aviation history. Asymmetrical stall and the ensuing roll of the aircraft because of the uncommanded retraction of the left wing outboard leading edge slats and the loss of stall warning and slat disagreement indication systems caused by separation of the engine and pylon. Improper maintenance procedures used by American Airlines when dismounting the engines for maintenance, by removing the pylon and engine together, putting strain on the engine mounts leading to  stress cracks.;Chicago, IL
3025;1979-05-27;?;Off Dakar, Senegal;Military - Mauritanian Air Force;flight no Definida;Bouceif - Dakar;de Havilland Canada DHC-5D Buffalo;5T-MAX;088;12;7;5;12;7;5;0;Crashed into the Atlantic Ocean during a blinding sandstorm. The pilot, unable to land due to the sandstorm headed out to sea for another approach when the accident occurred.;Bouceif 
3029;1979-07-11;1900;Near Medan Airfield, Indonesia;Garuda Indonesia Airlines;flight no Definida;Talang Betutu - Medan;Fokker F-28 Fellowship 1000;PK-GVE;11055;61;57;4;61;57;4;0;"Struck Mt. Sebayak at 5,500 ft. during its approach. Pilot error.The plane was named ""Mamberamo.""";Talang Betutu 
