Unnamed: 0;fecha;HORA declarada;Ruta;Operador;flight_no;route;ac_type;registration;cn_ln;all_aboard;PASAJEROS A BORDO;crew_aboard;cantidad de fallecidos;passenger_fatalities;crew_fatalities;ground;summary;Lugar_Despegue
3955;1995-05-01;1328;Sioux Falls, Ontario, Canada;Bearskin Airlines / Air Sandy;362 / 3101;Red Lake - Sioux Lookout  / Sioux Lookout - Red Lake;Swear. SA-227CC Metro 23/Piper Navajo;C-GYYB/ C-GYPZ;CC-827B /?;8;5;3;8;5;3;0;The SA-227 collided with the Piper PA-31-350 that was taking off while approaching Sioux Lookout. Neither flight crew saw the other aircraft in time to avoid the collision. The Piper crashed into a  wooded area and the Swearing into Lake Seul. Contributing to the occurrence were the inherent limitations of the see-and-avoid concept which preclude the effective separation of aircraft with high closure rates, the fact that neither crew was directly alerted to the presence of the other aircraft by the Flight Service specialist or by onboard electronic equipment and an apparent lack of pilot understanding of how to optimize avoidance maneuvering.;Red Lake 
3957;1995-05-09;1635;Cerro San Jeronimo, Colombia;ADES Colombia;flight no Definida;Mitu - Villavicencio;Curtiss C-46F;HK-3079G;22538;9;5;4;9;5;4;0;Crashed into a mountain during approach in poor weather.;Mitu 
3959;1995-05-24;1651;Near Leeds, England;Knight Air;816;Leeds - Aberdeen;Embraer 110 P1 Bandeirante;G-OEAA;110-256;12;9;3;12;9;3;0;The crew had serious problems maintaining their heading after both artificial horizons failed shortly after takeoff. The crew had difficulty controlling the aircraft in turbulent conditions and the plane went into a spiral dive and crashed into a field. One or possibly both of the aircraft's artificial horizons malfunctioned and in the absence of a standby horizon, for which there was no airworthiness requirement, there was no single instrument available for assured attitude reference or simple means of determining which flight instruments had failed. The pilot became spatially disoriented and was unable to maintain control.;Leeds 
3963;1995-06-16;?;Volgograd, Russia;Volga Air;flight no Definida;Poliny Osipenko - Nikolayevsk-on-Amur;Antonov 2R;CCCP-68142;1G195-47;12;0;0;12;0;0;0;Crashed in poor weather condtions.;Poliny Osipenko 
3964;1995-06-16;1415;Herputchi, Russia;Aeroflot;flight no Definida;Poliny - Nikolayevsk-on-Amur;Antonov AN-2;RA-07743;1G259-18;14;12;2;13;11;2;0;Flying VOR the plane ran into poor weather and the pilot decided to return however crashed into trees while attempting to land.;Poliny 
3965;1995-06-17;?;Near Cuvela, Angola;Military - Angolan Air Force;flight no Definida;Ondjiva - Catumbela;CASA 212-200 Aviocar;T401;A53-2-326;48;45;3;48;45;3;0;The aircraft, carrying members of a local soccer club crashed 10 miles short of it's destination. Adverse weather conditions and overloaded.;Ondjiva 
3966;1995-06-24;1605;Lagos, Nigeria;Harka Air Services;flight no Definida;Kaduna - Lagos;Tupolev TU-134A;RA-65617;4308068;80;74;6;16;16;0;0;Crashed while landing in heavy rain. Overshot runway, landing long, and collided with a concrete culvert.;Kaduna 
3969;1995-07-12;0800;Gumey, Papua New Guinea;Milne Bay Air;flight no Definida;Alotou - Dagura;de Havilland Canada DHC-6 Twin Otter 300;P2-MBI;275;15;13;2;15;13;2;0;Crashed on takeoff onto a beach in shallow water. An in-flight fire that originated near the rear cargo hold is believed to have started in a passenger's luggage from some type of flammable liquid.;Alotou 
3971;1995-07-18;?;Near Antananivo, Madagascar;Military - Madagascar Air Force;flight no Definida;Maintirano - Antananivo;Douglas C-47A;5R-MMG;19525;34;29;5;34;29;5;0;The aircraft, carrying a French medical team, crashed while attempting to land at Antananarivo. Double engine failure.;Maintirano 
3974;1995-08-09;?;Near Kaimana, Indonesia;Bourag Indonesia Airlines;flight no Definida;Tual - Langgar - Kaimana;Hawker Siddeley HS-748 2A;PK-KHL;1735;10;6;4;10;6;4;0;Crashed into Mt. Komawa at 9,200 ft. in poor weather. Found 8/14/95.;Tual 
3978;1995-09-01;1200;Near Farewell, Alaska;North Star Air Cargo;flight no Definida;Farewell - Anchorage;Shorts SC-7 Skyvan;N30GA;SH-1839;1;0;1;1;0;1;0;While en route the cargo plane flew into a 4,800 ft. mountain. The pilot's continued VFR flight into instrument meteorological conditions. The weather was a factor.;Farewell 
3983;1995-09-12;0720;Off Colombo, Sri Lanka;Military - Sri Lanka Air Force;flight no Definida;Ratmalana - Palali base;Antonov AN-32;CR861;3502;81;76;5;81;76;5;0;The pilot reported an instrument problem after taking off from Ratmalana Airport and was returning for an emergency landing when the plane fell from 8,000 feet and crashed into the sea.;Ratmalana 
3984;1995-09-15;1222;Tawau,  Malaysia;Malaysia Airlines;2133;Kota Kinabalu - Tawau;Fokker 50;9M-MGH;20174;53;49;4;34;32;2;0;Following a visual approach, the aircraft landed long and fast and overran the end of the runway into a shanty town while attempting a go-around.;Kota Kinabalu 
3986;1995-09-22;0745;Anchorage, Alaska;Military - U.S. Air Force;27;Anchorage-Elmendorf AFB - Anchorage-Elmendorf AFB;Boeing B-707 (E-3B);77-0354;21554/933;24;20;4;24;20;4;0;The aircraft suffered multiple bird strikes in the No. 1 and 2 engines just after taking off when it flew into a flock of 100 or more Canada Geese. The crew initiated a slow climb and began to dump fuel. The aircraft attained a maximum altitude of 250 ft. before it started to descend. The plane impacted a hilly wooded area less than a mile from the runway, broke up, exploded and burned.  Ingestion of Canada geese into the Nos.1 and 2 engines. Lack of adequate procedures to reduce bird hazards. The crew was not warned about observations of birds in the area by the ATC.;Anchorage
3987;1995-09-24;?;Sterligov Cape, Russia;Norilsk Flight Company;flight no Definida;Cape Chelyuskin - Sterligov Cope;Mil Mi-8T;RA-24553;98522942;15;10;5;15;10;5;0;Crashed through the ice while attempting to land and sank in shallow water. The weather conditions were below minima and the helicopter exceeded its maximum takeoff weight.;Cape Chelyuskin 
3988;1995-09-27;1910;Campbell River, British Columbia, Canada;Western Straits Air;flight no Definida;Triumph Bay - Campbell River;De Havilland Dash-3;C-FEBX;38;10;9;1;8;7;1;0;While on an intercept heading for the final approach and in straight-and-level flight, the aircraft crashed into the side of a 1,047 ft, mountain in heavy fog. The pilot progressively lost situational awareness while attempting to navigate in conditions of low visibility or in cloud and was unaware of the rapidly rising terrain in his flight path.;Triumph Bay 
3991;1995-11-09;2100;Near Luyaba, Argentina;Military - Argentine Air Force;flight no Definida;Comodoro Rivadavia - Cordoba;Fokker F-27 Friendship 500;TC-72;10619;53;48;5;53;48;5;0;The aircraft crashed into a 8,000 ft. mountain  in the Sierra Grande range while climbing en route from Comodoro Rivadavia to Cordoba in heavy rain and strong turbulence. The passengers included military personnel and their dependents.;Comodoro Rivadavia 
3992;1995-11-13;0855;Kaduna, Nigeria;Nigeria Airways;357;Jos - Kano;Boeing B-737-2F9;5N-AUA;22985;137;129;8;9;9;0;0;The aircraft touched down halfway down the runway, veered off the runway where dry grass caught fire under the aircraft and eventually spread destroying the aircraft.;Jos 
3996;1995-12-03;2244;Near Douala, Cameroon;Cameroon Airlines;3701;Cotonou - Douala;Boeing B-737-2K9;TJ-CBE;23386/1143;78;72;6;72;68;4;0;The plane went into a dive and crashed 6 km short of the runway into a swamp during a second attempt at landing. Loss of power in the No. 1 engine.;Cotonou 
3999;1995-12-13;1900;Verona  - Villafranca, Italy;Romanian Banat Air;166;Verona - Timisoara;Antonov AN-24B;YR-AMR;77303309;49;41;8;49;41;8;0;The plane crashed and burned shortly after takeoff after reaching a height of 500 ft. Combination of overloading and icing.;Verona 
4000;1995-12-18;?;Cahungula, Angola;Trans Service Airlift;flight no Definida;Jamba Airport - ?;Lockheed L-188C Electra;9Q-CRR;1080;144;139;5;141;137;4;0;The plane, chartered by the UNITA rebel movement, stalled and crashed shortly after takeoff from Jamba. Overloaded by 40 passengers. One report stated baggage shifted to the rear of the plane.;Jamba Airport 
4003;1996-01-08;?;Off Bridgetown, Barbados;Mustique Airways;flight no Definida;Union Island - Bridgetown;Britten-Norman BN-2A-27 Islander;J8-VAK;436;10;9;1;1;1;0;0;After losing an engine the plane began to lose altitude and ditched in the Atlantic Ocean 30 km southwest of Bridgetown.;Union Island 
4008;1996-02-05;0950;St. Johns, Arizona;Business Air Connection;flight no Definida;St. Johns, AZ - Brownsville, TX;ConvairCV-440;N131T;338;4;2;2;4;2;2;0;The cargo plane was unable to gain altitude while attempting to takeoff, overran the runway and hit power lines and a conrete barrier. Inadequate pre-flight planning and preparation by the PIC, his failure to ensure the aircraft was properly loaded within limitations, his failure to use proper flaps for takeoff, his failure to use ADI (Antidetonation Injection) assisted takeoff, and his resultant failure to attain sufficient airspeed to climb after takeoff. Factors relating to the accident were: the high density altitude, and the PIC's lack of experience in the make and model of airplane.;St. Johns, AZ 
4009;1996-02-06;2347;Off Puerto Plata, Domincan Republic;Alas Nacionales, leased from Birgen Air;301;Puerto Plata - Gander;Boeing B-757-225;TC-GEN;22206/31;189;176;13;189;176;13;0;The plane crashed into the Atlantic Ocean, 21 km north of Puerto Plata, shortly after taking off. Incorrect airspeed indications resulting from a clogged pitot tube. The readings were greater than the actual airspeed resulting in the crew reducing  power and leading to a stall. Failure of the crew to recognize the activation of the control column shaker as a warning of an imminent stall. Failure of the crew to carry out the procedures to recover the aircraft from the stall and restore lift.;Puerto Plata 
4011;1996-02-12;1201;Port-au-Prince, Hati;Hati Express;flight no Definida;Port-au-Prince - Cap Haitien;GAF Nomad N-24A;N224E;62;15;13;2;11;9;2;0;Shortly after lifting off of the ground, the aircraft rolled to the right and struck the ground ending up inverted in a ditch.;Port
4012;1996-02-26;1900;Near Jabal Awliya, Sudan;Military - Sudanese Air Force;flight no Definida;El Obeid - Khartoum;Lockheed C-130H;Placa de Avion no Definida;cn_ln no Definida;91;85;6;91;85;6;0;Crashed SW of Khartoum while attempting an emergency landing after reporting an in-flight out of control fire.;El Obeid 
4013;1996-02-27;0540;Near Lukapa, Angola;Aero Tropical;flight no Definida;Ludana - Lukapa;Antonov 12BP;ER-ACE;402812;8;3;5;8;3;5;0;The cargo plane crashed in rain and poor visibility while on approach.;Ludana 
4015;1996-03-09;?;Near Mesones Muro, Peru;Military - Peruvian Army Aviation;flight no Definida;Condorcanqui - Bagua;Mil Mi-17;EP561;cn_ln no Definida;23;0;0;23;0;0;0;Crashed and exploded north of it's destination in heavy fog after flying into a mountain ridge.;Condorcanqui 
4017;1996-04-03;1452;Near Dubrovnik, Croatia;Military - U.S. Air Force;21;Tizla - Dubrovnik;Boeing B-737-T43;73-1149;20696/347;35;29;6;35;29;6;0;The aircraft strayed off course and hit St. John Hill at an altitude of 2,200 feet, 16km SE of Dubrovnik while attempting to land in poor weather conditions. U.S. Secretary of Commerce, Ron Brown, 55, killed. Crew error.  Failure of the crew to comply with directives that required a review of all instrument approach procedures, not approved by the Defense Dept. Preflight planning errors, combined with errors made during the flight by the crew. Rumors persist that the accident was a result of sabotage.;Tizla 
4020;1996-04-11;0824;Cheyenne, Wyoming;Private;flight no Definida;Cheyenne, WY - Lincoln, NE;Cessna 177B;N35207;17702266;3;2;1;3;2;1;0;Seven- year-old trainee pilot, Jessica Dubroff, accompanied by her father (a passenger) and the pilot-in-command, were engaged in a trans-continental record attempt involving 6,660 miles of flying in 8 consecutive days. The plane departed towards a nearby thunderstorm in deteriorating weather. Witnesses describe the plane's climb rate and speed as slow and they observed the aircraft enter a roll consistent with a stall. The plane's gross weight was 84 pounds over the maximum limit. Pilot's improper decision to take off into deteriorating weather conditions when the airplane was overweight resulting in stall caused by failure to maintain airspeed.;Cheyenne, WY 
4023;1996-05-10;?;Otaez, Mexico;Aeroservicios Empresariales de Durango;flight no Definida;Durango - Otaez;de Havilland Canada DHC-6 Twin Otter 200;XA-SWJ;126;19;17;2;16;14;2;0;Crashed into high ground while attempting to land at a mine airstrip in turbulence and stong gusty winds.;Durango 
4025;1996-05-11;1315;Oumba, Papua New Guinea;Milne Bay Air;flight no Definida;Menyamya - Marakawa;Britten Norman BN-2A-20 Trislander;P2-ISD;582;10;9;1;1;1;0;0;Crashed into a ridge line shrouded in clouds while en route.;Menyamya 
4026;1996-05-19;2336;Griesta, United Kingdom;Loganair;flight no Definida;Inverness - Lerwick;Britten-Norman BN-2A-26 Islander;G-BEDZ;544;3;2;1;3;2;1;0;Crashed during a second attempt at landing;Inverness 
4027;1996-06-06;?;Kinshasa, Democratic Republic Congo;Hoseba;flight no Definida;Kinshasa, Congo  - Athens, Greece;Ilyushin 76MD;UR-76539;0033442234;10;2;8;10;2;8;0;Crashed during takeoff.;Kinshasa, Congo  
4031;1996-06-21;1704;Shanghai, China;China Flying Dragon Aviation (Feilong Airlines);flight no Definida;Dalian - Shanghai;Harbin Yunshuji Y-12-II;B-3822;0001;12;9;3;2;1;1;0;The aircraft crashed into a mountain after deviating off course during a landing attempt.;Dalian 
4032;1996-07-06;1542;Pensacola, Florida;Delta Air Lines;1288;Pensacola - Atlanta;McDonnell Douglas MD-88;N927DA;49714/1524;142;137;5;2;2;0;0;Fan disk separation in the left engine. Pieces of the engine penetrated the passenger cabin killing two passengers. The fan hub for the left engine was found to be fractured and went undetected at time of manufacture. The crack should have been detectable during inspection but was missed.;Pensacola 
4033;1996-07-09;1630;Papua, New Guinea;Milne Bay Air;flight no Definida;Bosavi - Mendi;de Havilland Canada DHC-6 Twin Otter 300;P2-MBB;290;20;19;1;20;19;1;0;Just after beginning its final approach, the aircraft crashed into the side of a  mountain at about 9,200 feet in rain and poor visibility.;Bosavi 
4035;1996-07-15;1800;Near Eindhoven, The Netherlands;Military - Belgian Air Force;flight no Definida;Villafranca, Italy - Eindhoven AB;Lockheed C-130H;CH-06;4473;41;37;4;34;30;4;0;Crashed and burned while attempting to land at Eindhoven Air Base. The aircraft collided with a large flock of lapwings and starlings, causing failure of the No. 1, 2, and 3 engines after which the port wing hit the ground and the plane exploded in flames. Aboard were members of a  Dutch Army Band returning from Italy.;Villafranca, Italy 
4036;1996-07-17;1635;Near Playa del Carmen, Mexico;Aerolatino (Aerocaribe);flight no Definida;Holvox Island - Playa del Carmen;de Havilland Canada DHC-6 Twin Otter 300;XA-TCF;734;18;16;2;1;1;0;0;Crashed 150 ft. short of the runway.;Holvox Island 
4038;1996-07-20;1515;Russian Mission, Alaska;Northern Air Cargo;33;Emmonak - Aniak;Douglas DC-6A;N313RS;44663/630;4;1;3;4;1;3;0;"Soon after takeoff, the No. 3 engine caught fire in the cargo plane. The pilot tried to return to the airport for an emergency landing but the right wing seperated and the plane crashed. Fatigue failure of the master connecting rod, which originated from corrosion pitting, subsequently compromised the engine crankcase, and resulted in a fire; and failure of the flight crew to follow emergency procedures by pulling the fire handle before feathering the propeller, which diminished the effectiveness of the fire suppression system.";Emmonak 
4040;1996-08-12;1347;Markham Bay, Canada;First Air;64;Iqaluit - Markham Bay;de Havilland Canada DHC-6 Twin Otter 300;C-GNDN;427;2;0;2;2;0;2;0;After touching down, the cargo plane bounced twice and continued to the end of the runway, became airborne but crashed terrain. For unknown reasons, a decision was made to overshoot even though insufficient runway remained for acceleration, take-off, and climb. Likely contributing directly to the decision to overshoot was the difficulty in controlling the aircraft on touchdown.;Iqaluit 
4041;1996-08-14;?;Near Bronson Creek, British Columbia, Canada;Air North;flight no Definida;Bronson Creek - Wrangell;Douglas DC-4;C-FGNI;10389/120;3;0;3;1;0;1;0;After taking off the  No. 2 engine of the cargo plane caught on fire. The pilot tried to land the plane in a river bed. The number 2 engine separated from the aircraft as a result of an intense fire in the wing. The loss of the engine rendered the aircraft uncontrollable, and the pilots were forced to land in the river.;Bronson Creek 
4042;1996-08-17;2348;Near Jackson Hole, Wyoming;Military - U.S. Air Force;flight no Definida;Jackson Hole, WY - New York, NY;Lockheed C-130H Hercules;74-1662;4597;9;1;8;9;1;8;0;The plane struck a mountain. Failure of the crew to monitor the aircraft's position and flight path relative to high terrain surrounding Jackson Hole Airport.;Jackson Hole, WY 
4043;1996-08-18;1950;Near Alliford Bay, British Columbia, Canada2;Harbour Air;flight no Definida;Tasu - Alliford;de Havilland Canada DHC-3 Turbo Otter;C-GCMY;32;3;2;1;3;2;1;0;While en route, flew into the side of a mountain. The pilot probably made a navigational error because of restricted visibility in fog and light drizzle and entered the wrong valley, and he delayed his decision to reverse course until he was unable to avoid the weather.;Tasu 
4046;1996-09-25;1637;Waddenzee, Netherlands;Dutch Dakota Association;flight no Definida;Texel - Amsterdam;Douglas DC-3C;PH-DDA;19109;32;26;6;32;26;6;0;Shortly after takeoff from Texel, a connecting rod bearing in the No.1 engine failed. The prop was feathered.  Soon after, a part of the feathering mechanism failed and the prop started windmilling causing drag. The aircraft rapidly descended and crashed onto a mud-flat. The accident was initiated by a combined failure of the left engine and the left feathering system. The accident became inevitable when the flight crew allowed the speed to decrease below stall speed and lost control of the aircraft at an altitude from which recovery was not possible.;Texel 
4051;1996-10-22;2241;Manta, Ecuador;Million Air;flight no Definida;Manta - Miami;Boeing B-707-323C;N751MA;19582/639;4;0;4;4;0;4;30;The cargo plane, carrying flowers and frozen fish crashed into the Dolorosa district, bursting into flames shortly after taking off. One engine caught fire during the climb-out.;Manta 
4058;1996-11-14;1302;Bolchaïa Pyssa, Russia;Komi Avia;flight no Definida;Most Pyssa - Koslan;Antonov AN-2;RA-40309;1G221-39;15;13;2;14;13;1;0;Lost altitude and crashed while en route in poor weather. Stall of the left wing due to icing.;Most Pyssa 
4059;1996-11-19;1701;Quincy, Illinois;United Express  / Private;5925;Burlington, IA - Quincy, IA;Beechcraft 1900-C / Beech King Air A90;N87GL / N1127D;UC-87 /;14;10;4;14;10;4;0;"While landing on Runway 13 at Baldwin Field, the United Express collided with the King Air which was taking off on Runway 4. The collision took place where the two runways intersect. Both planes caught fire and rescuers were unable to open the door to the Beech 1900-C because of impact damage. All twelve aboard the United Express and the two pilots aboard the King Air were killed. King Air pilots' failure to use proper communications and ""see-and-avoid"" procedures at an uncontrolled airport. Involvement of a third aircraft that transmitted unnecessary and inappropriate messages.";Burlington, IA 
4060;1996-11-22;1930;Off Cape Mendocino, CA;Military - U.S. Air Force;flight no Definida;San Diego, CA - Portland, OR;Lockheed HC-130P Hercules;64-14856;4072;11;0;11;10;0;10;0;Crashed 60 miles west of Cape Mendocino in the Pacific Ocean. The crew reported losing an engine, followed by complete electrical failure.;San Diego, CA 
4062;1996-11-27;1154;Abakan, Siberia, Russia;Military - Russian Air Force;flight no Definida;Abakan - Petropavlosk - Kamchatsky;Ilyushin IL-76MD;RA-76804;0093492278;23;19;4;23;19;4;0;The aircraft crashed shortly after takeoff. Overloaded.;Abakan 
4064;1996-12-07;1523;Banjarmasin, Indonesia;Dirgantara Air Services;flight no Definida;Banjarmasin - Sampit;CASA 212 Aviocar 100;PK-VSO;152/26N;17;15;2;16;14;2;2;After experiencing a No.2 engine fire and while attempting to return to the airport, the aircraft's wing struck a building short of the runway.;Banjarmasin 
4069;1996-12-24;1005;Dorchester, New Hampshire;Aircraft Charter Group Inc;flight no Definida;Bridgeport, CT - Lebanon, NH;Learjet 35A;N388LS;35-388;2;0;2;2;0;2;0;"The cargo plane was on a positioning flight when it struck rising terrain while making an approach to land. The captain's failure to maintain situational awareness, which resulted in the airplane being outside the confines of the instrument approach; and the crew's misinterpretation of a step-down fix passage, which resulted in an early descent into rising terrain. Factors included the captain's misreading of the instrument approach procedure, the crew's rushed and incomplete instrument approach briefing, their failure to use additional, available navigational aids, and their failure to account for the winds at altitude.";Bridgeport, CT 
4070;1996-12-24;1500;Near Nellore, India;Military - Indian Air Force;flight no Definida;Tanbaram AFB - Hyderabad;Hindustan Aeronautics 748-2;H1032;528;22;17;5;22;17;5;0;Crashed while en route after the pilot reported an engine fire. Undetected cracks in the engine not detected during routine maintenance.;Tanbaram AFB 
4071;1997-01-07;1100;Near Moamoa, Samoa;Polynesian Airlines;211;Pago Pago - FagaliI;de Havilland Canada DHC-6 Twin Otter 300;5W-FAU;678;5;3;2;3;2;1;0;Crashed onto a mountin in high winds and rain after being diverted from another airport.;Pago Pago 
4073;1997-01-29;2310;Sparrevohn, Alaska;Southcentral Air;flight no Definida;St. Marys - Kenai;de Havilland Canada DHC-4A Caribou;N702SC;126;2;0;2;1;0;1;0;"While en rote the plane experienced engine trouble. The crew decided to divert to Sparrevohn. While attempting to land the plane encountered strong turbulence from surrounding mountains. Although full power was applied to the good engine the plane crashed into terrain. Loss of the right engine propeller control oil, which led to an overspeed of the right engine and propeller, and necessitated a shut-down of the right engine; and failure of the pilot to maintain adequate altitude/distance from terrain during visual approach for a precautionary landing at an alternate airport. Factors relating to the accident were: fluctuation of the left engine power, premature lowering of the airplane flaps, and an encounter with adverse weather conditions (including high winds, severe turbulence, and white-out conditions) during the approach.";St. Marys 
4075;1997-02-01;1438;Tambacoumba, Senegal;Air Senegal;flight no Definida;Tambacounda - Dakar;Hawker Siddeley HS-748-353 Srs.2a;6AV-AEO;1769;52;49;3;25;22;3;0;The aircraft crashed shortly after taking off fromTambacoumba after losing power in the left engine. Fuel contamination.;Tambacounda 
4079;1997-02-19;0306;Guatemala City, Guatemala;Transpolar;flight no Definida;Lima, Peru - Guatemala City, Guatemala;IAI 1124 Westwind;YV-160CP;211;5;4;1;5;4;1;0;Flew into a mountain while on approach.;Lima, Peru 
4081;1997-03-13;1806;Near Mashhad, Iran;Military - Iranian Air Force;flight no Definida;Dezful - Mashhad;Lockheed C-130HF;Placa de Avion no Definida;cn_ln no Definida;88;80;8;88;80;8;0;The plane was carrying military personnel and their families and crashed 24 miles NE of Mashhad in the Binalud Heights. The pilot reported engine failure prior the crash.;Dezful 
4082;1997-03-18;1004;Cherkessk, Russia;Stavropol Airlines;1023;Stavropol - Trabzon;Antonov AN-24RV;RA-46516;37308502;50;44;6;50;44;6;0;The aircraft lost altitude from FL 197 and crashed into a forest while en route from Stavropol, Russia to Trabzon, Turkey. Reports indicated that an in-flight  fire and an explosion led to the separation of the tail section prior to the crash. Superficial mechanical inspection of the aircraft which was carried out without the use of monitoring instruments and subsequent unjustified decision to extend the time between overhauls.  Inadequate monitoring to determine the state of structural elements and detect the presence of corrosion in hard-to-reach areas under the floor of the fuselage. Failure to carry out prescribed anti-corrosion measures on the aircraft structure during overhaul.;Stavropol 
4084;1997-04-04;0016;Griffin, Georgia;Custom Air Service;flight no Definida;Griffin - Americus;Aviation Traders ATL-98 Carvair;N83FA;10365;2;0;2;2;0;2;0;On a positioning flight, while taking off the plane suffered engine failure, overran the runway and crashed into a vacant building.;Griffin 
4085;1997-04-10;2030;Near Wainwright, Alaska;Hageland Aviation Services;502;Barrow - Wainwright;Cessna 208B Caravan I;N408GV;208B-0455;5;4;1;5;4;1;0;After making two approaches the pilot decided to head back to the departure airport. He flew north at an altitude beneath minimum radar coverage. The plane impacted the frozen Arctic Ocean in a right bank and at a 60 degree nose-down attitude. The pilot's intentional VFR flight into instrument meteorological conditions and his failure to maintain altitude and clearance from terrain. A contributing factor was the weather conditions.;Barrow 
